{
  "id": "patch_example_0001",
  "type": "prompt_patch",
  "channel": "experimental",
  "target": "role_pack:general:system_context",
  "change": {
    "append": "Prefer concrete examples over abstract description."
  },
  "rationale": "Demo runs were too abstract; concrete examples improve clarity.",
  "created_at": "2026-05-21T00:00:00Z",
  "eval_run": null,
  "source": "dream_mode"
}
